{
  "F": 12,
  "E": 5,
  "eps": [0,0,1,1,1,2,2,3,3,4,4,4],
  "ties": [
    [0,5],
    [1,7],
    [2,3],
    [9,10]
  ],
  "w": [
    {"e": 0, "val": 1.0, "type": "spring", "k": 20.0, "rest": 30.0},
    {"e": 1, "val": 2.0, "type": "weight"},
    {"e": 2, "val": 0.5, "type": "conductance"},
    {"e": 3, "val": 1.5, "type": "capacity"},
    {"e": 4, "val": 3.0, "type": "resistance"}
  ],
  "meta": {
    "schema": 1,
    "oriented": false,
    "name": "engi_triangle",
    "semiring": "R",
    "description": "Triangle with derived nodes from equivalence classes",
    "local_rules": [
      {
        "pattern": ["adjacent_flags"],
        "replacement": ["tie_if_same_field"]
      }
    ]
  }
}
